{
  "specversion": "1.0",
  "id": "44444444-4444-4444-8444-444444444444",
  "source": "https://omama.vn/services/fulfillment-service",
  "type": "vn.omama.fulfillment.packing.completed.v2",
  "subject": "order_id:11111111-1111-4111-8111-111111111111",
  "time": "2026-10-26T01:00:00Z",
  "datacontenttype": "application/json",
  "traceparent": "00-11111111111111111111111111111111-2222222222222222-01",
  "data": {
    "order_id": "11111111-1111-4111-8111-111111111111",
    "package_id": "33333333-3333-4333-8333-333333333333",
    "packer_staff_id": "55555555-5555-4555-8555-555555555555",
    "seal_code": "SEAL-MVP-001",
    "parcel": {
      "weight_grams": 500,
      "length_cm": 20,
      "width_cm": 10,
      "height_cm": 5,
      "fragile": true
    },
    "s3_video_object_key": "synthetic/packing.mp4",
    "video_checksum_sha256": "aaaaaaaaaaaaaaaaaaaaaaaaaaaaaaaaaaaaaaaaaaaaaaaaaaaaaaaaaaaaaaaa",
    "scanned_batch_codes": [
      "BATCH-MVP-001"
    ],
    "packed_at": "2026-10-26T00:00:00Z",
    "task_id": "66666666-6666-4666-8666-666666666666",
    "resource_version": 2,
    "ready_generation": 1
  }
}
